{"actions":{"build":{"max_output_bytes":65536,"network":"none","timeout_ms":8000},"submit":{"max_output_bytes":131072,"network":"none","timeout_ms":20000},"test":{"max_output_bytes":65536,"network":"none","timeout_ms":8000},"vet":{"max_output_bytes":65536,"network":"none","timeout_ms":8000}},"artifact_rules":{"logs":["build","test","vet","submit"],"workspace":"diff"},"assessment_rules":[{"capability_refs":[{"id":"M1-11","version":1}],"condition":"passed","evidence_type":"implement","rule_id":"bounded-concurrency-respected","selector":{"test":"TestGenerateBoundsConcurrency"},"stage":"held_out_test"},{"capability_refs":[{"id":"M1-11","version":1}],"condition":"passed","evidence_type":"implement","rule_id":"pipeline-completes-without-leak","selector":{"test":"TestGenerateClosesAndReleasesWorkers"},"stage":"held_out_test"}],"editable_paths":["thumbnail.go"],"files":[{"editable":false,"path":"README.md","role":"readme","sha256":"356f5f30d21487c0c2092e5daf93913312901ed0e51d0c6781a03269fe6b7d74","source":"README.md"},{"editable":false,"path":"go.mod","role":"starter","sha256":"6a7be0cc0432138f943727f09678619c285143fd065a35135b646e60299c36b0","source":"starter/go.mod"},{"editable":true,"path":"thumbnail.go","role":"starter","sha256":"306bb71d2d34314d5cb2015daa15764e178d3e00b33305ac6851b066268b0a64","source":"starter/thumbnail.go"},{"editable":false,"path":"thumbnail_private_test.go","role":"held_out_test","sha256":"f5ba0085e1d61a7ef4176bff716e1e0fb4499ed3d1adeed039a1a46a34fec3bd","source":"heldout/thumbnail_private_test.go"}],"held_out_tests":["thumbnail_private_test.go"],"hints":[{"body":"重新写出 jobs、worker、results 的所有权和关闭时机；领域对象变化不会改变生命周期不变量。","id":"transfer-invariants","level":1,"title":"迁移结构，不迁移名字"}],"id":"review-thumbnail-pipeline-v1","language":"go1.25","limits":{"max_file_bytes":65536,"max_files":8,"max_total_bytes":262144},"race_tests":[],"readonly_paths":["README.md","go.mod"],"version":1,"visible_tests":[],"workspace_root":"workspace"}