{"actions":{"build":{"max_output_bytes":65536,"network":"none","timeout_ms":8000},"submit":{"max_output_bytes":131072,"network":"none","timeout_ms":15000},"test":{"max_output_bytes":65536,"network":"none","timeout_ms":8000},"vet":{"max_output_bytes":65536,"network":"none","timeout_ms":8000}},"artifact_rules":{"logs":["build","test","vet","submit"],"workspace":"full"},"assessment_rules":[{"capability_refs":[{"id":"M1-04","version":1}],"condition":"passed","evidence_type":"implement","rule_id":"slice-ownership-isolated","selector":{"test":"TestDetachPayloadOwnsStorage"},"stage":"held_out_test"},{"capability_refs":[{"id":"M1-04","version":1}],"condition":"passed","evidence_type":"implement","rule_id":"map-contract-correct","selector":{"test":"TestFrequencyReturnsWritableMap"},"stage":"held_out_test"}],"editable_paths":["frame.go"],"files":[{"editable":false,"path":"README.md","role":"readme","sha256":"9b961c0c73302d78ea6e13176c262d48fc707b5a386406e26f27113862211bd2","source":"README.md"},{"editable":false,"path":"go.mod","role":"starter","sha256":"db7734de14941499c9ec26e0a8a011f8ee071da1a03fd4d5ee5b0b60d6940e2d","source":"starter/go.mod"},{"editable":true,"path":"frame.go","role":"starter","sha256":"6251151553b14596b865efbb814d1e77b9a8eeca51c3a7d267e9f54514836c10","source":"starter/frame.go"},{"editable":false,"path":"frame_test.go","role":"visible_test","sha256":"70146043ae77d80a5bea3b196455045dee3cdeea9d33fecb4ac19e2b3cfbff54","source":"visible/frame_test.go"},{"editable":false,"path":"frame_heldout_test.go","role":"held_out_test","sha256":"89f40572ce04de4936b276526cbbabe2e804fe7e09d4fb7a144fffaec247c364","source":"heldout/frame_heldout_test.go"}],"held_out_tests":["frame_heldout_test.go"],"id":"review-byte-frames-v1","language":"go1.25","limits":{"max_file_bytes":65536,"max_files":8,"max_total_bytes":262144},"readonly_paths":["README.md","go.mod","frame_test.go"],"version":1,"visible_tests":["frame_test.go"],"workspace_root":"workspace"}