{"actions":{"build":{"max_output_bytes":65536,"network":"none","timeout_ms":8000},"submit":{"max_output_bytes":262144,"network":"none","timeout_ms":30000},"test":{"max_output_bytes":65536,"network":"none","timeout_ms":8000},"vet":{"max_output_bytes":65536,"network":"none","timeout_ms":8000}},"artifact_rules":{"logs":["build","test","vet","submit"],"workspace":"diff"},"assessment_rules":[{"capability_refs":[{"id":"M1-12","version":1}],"condition":"passed","evidence_type":"implement","rule_id":"registry-contract-correct","selector":{"test":"TestLedgerSnapshotOwnsState"},"stage":"held_out_test"},{"capability_refs":[{"id":"M1-12","version":1}],"condition":"passed","evidence_type":"implement","rule_id":"race-detector-clean","selector":{"package":"./..."},"stage":"race"},{"capability_refs":[{"id":"M1-12","version":1}],"condition":"passed","evidence_type":"diagnose","rule_id":"synchronization-choice-explained","selector":{"minimum_chars":40},"stage":"explanation"}],"editable_paths":["ledger.go"],"files":[{"editable":false,"path":"README.md","role":"readme","sha256":"4fb522f0849131841cf0cb25a12af815eca4a43c82b738673d0bc4f4eb0ff1c7","source":"README.md"},{"editable":false,"path":"go.mod","role":"starter","sha256":"c6bfb0ea5ff1c48ef6e8c32af2e99c30ffa81e5ff3f878f668dafdf92f5f3dc7","source":"starter/go.mod"},{"editable":true,"path":"ledger.go","role":"starter","sha256":"73b4af802fbab3ec4d25e8fe756e643585c68d1ea6fd96869819b2cfc9eefbd2","source":"starter/ledger.go"},{"editable":false,"path":"ledger_private_test.go","role":"held_out_test","sha256":"560f1e739b743d0f418d557d2a42a584ac7996b882c9e555bf47b8fc13f9cfc7","source":"heldout/ledger_private_test.go"},{"editable":false,"path":"ledger_race_test.go","role":"race_test","sha256":"ee5f8701cda3e64aabc625f504a019454afdac89ea0aa9551d02d8b61ee0b101","source":"race/ledger_race_test.go"}],"held_out_tests":["ledger_private_test.go"],"hints":[{"body":"Credit 与 Balances 都访问 balances；复制快照时也不能与写入并发。","id":"same-boundary","level":1,"title":"更新和复制共享同步边界"}],"id":"review-concurrent-ledger-v1","language":"go1.25","limits":{"max_file_bytes":65536,"max_files":10,"max_total_bytes":262144},"race_tests":["ledger_race_test.go"],"readonly_paths":["README.md","go.mod"],"version":1,"visible_tests":[],"workspace_root":"workspace"}