{"actions":{"submit":{"max_output_bytes":131072,"network":"none","timeout_ms":15000},"test":{"max_output_bytes":65536,"network":"none","timeout_ms":8000},"vet":{"max_output_bytes":65536,"network":"none","timeout_ms":8000}},"artifact_rules":{"logs":["test","vet","submit"],"workspace":"diff"},"assessment_rules":[{"capability_refs":[{"id":"M1-12","version":1}],"condition":"passed","evidence_type":"implement","rule_id":"shared-state-practiced","selector":{"test":"TestCounterSupportsConcurrentAdd"},"stage":"visible_test"}],"editable_paths":["counter.go"],"files":[{"editable":false,"path":"README.md","role":"readme","sha256":"80f76fe54ecddcb63ae6abc4e32ee574c8546856e0bd6f2f797148f81056f29c","source":"README.md"},{"editable":false,"path":"go.mod","role":"starter","sha256":"a131e2e127f9a229f83d4bd773e7ccfe761ed3aeb016957ced3e5ec894b0944a","source":"starter/go.mod"},{"editable":true,"path":"counter.go","role":"starter","sha256":"65ebde6275b6c2860abb3ed144e9637e64ef466d7fd1a69f91fd766430967842","source":"starter/counter.go"},{"editable":false,"path":"counter_test.go","role":"visible_test","sha256":"d059045ea37fc660cc76311af10c7ef62ea467aba979a62f226d532db35ce2db","source":"visible/counter_test.go"}],"held_out_tests":[],"hints":[{"body":"只保护 Add 仍会让 Value 与写入并发；先列出所有访问点，再让它们遵守同一 happens-before 关系。","id":"protect-read-write","level":1,"title":"读写使用同一同步规则"},{"body":"单个整数可用 atomic；未来若多个字段必须一致更新，mutex 更容易表达复合不变量。","id":"match-primitive","level":2,"title":"让原语匹配状态"}],"id":"practice-protected-counter-v1","language":"go1.25","limits":{"max_file_bytes":65536,"max_files":8,"max_total_bytes":262144},"race_tests":[],"readonly_paths":["README.md","go.mod","counter_test.go"],"version":1,"visible_tests":["counter_test.go"],"workspace_root":"workspace"}