{"actions":{"build":{"max_output_bytes":65536,"network":"none","timeout_ms":8000},"submit":{"max_output_bytes":131072,"network":"none","timeout_ms":15000},"test":{"max_output_bytes":65536,"network":"none","timeout_ms":8000},"vet":{"max_output_bytes":65536,"network":"none","timeout_ms":8000}},"artifact_rules":{"logs":["build","test","vet","submit"],"workspace":"full"},"assessment_rules":[{"capability_refs":[{"id":"M2-04","version":1}],"condition":"passed","evidence_type":"implement","rule_id":"sql-pool-practiced","selector":{"test":"TestConfigurePool"},"stage":"visible_test"}],"editable_paths":["sqlpool/pool.go"],"files":[{"editable":false,"path":"README.md","role":"readme","sha256":"1acdb262f61f92bf67c4ba95497544ea3b222bdab4e2e49f87051ad9479a46dc","source":"README.md"},{"editable":false,"path":"go.mod","role":"starter","sha256":"1a3440c3bebbedb74e39b94236596663c1c233ec2d87f5854cc797fa75765372","source":"starter/go.mod"},{"editable":true,"path":"sqlpool/pool.go","role":"starter","sha256":"e8a8d844b7ab47611fdf3e54828373e52ba277cac90e3cfbc8b0fb87485ef06f","source":"starter/sqlpool/pool.go"},{"editable":false,"path":"sqlpool/pool_test.go","role":"visible_test","sha256":"71eebee743daad811527653be7e18857ea4c57dbb2b4818039b37b25e2371752","source":"visible/sqlpool/pool_test.go"}],"held_out_tests":[],"hints":[{"body":"不要 Ping 或打开单条连接；验证后直接调用四个 setter，应用生命周期结束时才 Close DB。","id":"db-is-pool","level":1,"title":"DB 是连接池句柄"},{"body":"四个值都必须为正，且 MaxIdle 不能超过 MaxOpen。","id":"capacity-invariant","level":2,"title":"先验证容量关系"}],"id":"practice-sql-pool-v1","language":"go1.25","limits":{"max_file_bytes":65536,"max_files":8,"max_total_bytes":262144},"race_tests":[],"readonly_paths":["README.md","go.mod","sqlpool/pool_test.go"],"version":1,"visible_tests":["sqlpool/pool_test.go"],"workspace_policy":{"allow_delete_files":false,"allow_new_files":false},"workspace_root":"workspace"}