{"actions":{"build":{"max_output_bytes":131072,"network":"none","timeout_ms":10000},"submit":{"max_output_bytes":262144,"network":"none","timeout_ms":35000},"test":{"max_output_bytes":131072,"network":"none","timeout_ms":15000},"vet":{"max_output_bytes":131072,"network":"none","timeout_ms":10000}},"artifact_rules":{"logs":["build","test","vet","submit"],"workspace":"full"},"assessment_rules":[{"capability_refs":[{"id":"M2-13","version":1}],"condition":"passed","evidence_type":"test","rule_id":"quality-builds","selector":{"package":"./..."},"stage":"build"},{"capability_refs":[{"id":"M2-13","version":1}],"condition":"passed","evidence_type":"test","rule_id":"unit-test-boundary","selector":{"test":"TestUnitBoundarySupportsDeterministicClockAndStoreFake"},"stage":"held_out_test"},{"capability_refs":[{"id":"M2-13","version":1}],"condition":"passed","evidence_type":"test","rule_id":"handler-test-boundary","selector":{"test":"TestHandlerBoundaryUsesServiceFakeAndStableProtocol"},"stage":"held_out_test"},{"capability_refs":[{"id":"M2-13","version":1}],"condition":"passed","evidence_type":"test","rule_id":"fixture-contract","selector":{"test":"TestFixtureSupportsLayeredScenarios"},"stage":"held_out_test"},{"capability_refs":[{"id":"M2-13","version":1}],"condition":"passed","evidence_type":"test","rule_id":"service-test-cases","selector":{"file":"internal/alertquality/service_test.go","minimum_cases":6},"stage":"ast"},{"capability_refs":[{"id":"M2-13","version":1}],"condition":"passed","evidence_type":"test","rule_id":"service-fakes-used","selector":{"file":"internal/alertquality/service_test.go","required_calls":["service.Create","clock.Now"]},"stage":"ast"},{"capability_refs":[{"id":"M2-13","version":1}],"condition":"passed","evidence_type":"test","rule_id":"handler-httptest-used","selector":{"file":"internal/alertquality/handler_test.go","required_calls":["httptest.NewRequest","httptest.NewRecorder","handler.ServeHTTP"]},"stage":"ast"},{"capability_refs":[{"id":"M2-13","version":1}],"condition":"passed","evidence_type":"test","rule_id":"postgres-integration-wired","selector":{"file":"internal/alertquality/postgres_integration_test.go","required_calls":["sql.Open","db.PingContext","t.Cleanup","db.ExecContext"]},"stage":"ast"},{"capability_refs":[{"id":"M2-13","version":1}],"condition":"passed","evidence_type":"diagnose","rule_id":"quality-boundaries-explained","selector":{"minimum_chars":180,"required_terms":["unit test","httptest","fixture","PostgreSQL","deterministic clock"]},"stage":"explanation"}],"editable_paths":["internal/alertquality/service_test.go","internal/alertquality/handler_test.go","internal/alertquality/postgres_integration_test.go"],"files":[{"editable":false,"path":"TASK.md","role":"readme","sha256":"7938c36bae8d011969b8e8b851b3929bc51bf29df5932bbf2210bc4d3ed05999","source":"README.md"},{"editable":false,"path":"go.mod","role":"starter","sha256":"425557aa21688ee30cec6509f79345908da88ed97418e595627b00cb60f3542e","source":"starter/go.mod"},{"editable":false,"path":"internal/alertquality/app.go","role":"starter","sha256":"b63821cf2edb9b57fb4f75ae7993d30dd05b24deea59bb80dcffc741c5e24164","source":"starter/internal/alertquality/app.go"},{"editable":true,"path":"internal/alertquality/service_test.go","role":"starter","sha256":"15aafa9dac0d2a4b17419f77fc6d09a332f7acae6754622c361b63d4662a34eb","source":"starter/internal/alertquality/service_test.go"},{"editable":true,"path":"internal/alertquality/handler_test.go","role":"starter","sha256":"5fd100c7b09027209f116e7856f3bb1c369be2997a5616879b781da707e785f7","source":"starter/internal/alertquality/handler_test.go"},{"editable":true,"path":"internal/alertquality/postgres_integration_test.go","role":"starter","sha256":"4a2c45c2aba06ab7a35a088c3145bfe7b8434f4eeab2170989b7f1c9b3a24cdd","source":"starter/internal/alertquality/postgres_integration_test.go"},{"editable":false,"path":"internal/alertquality/testdata/alerts.json","role":"fixture","sha256":"517cb38d63814c0d12dd4af9fed6977f86fcf7c05e134385f39ba9f4939c1a25","source":"fixtures/internal/alertquality/testdata/alerts.json"},{"editable":false,"path":"internal/alertquality/smoke_test.go","role":"visible_test","sha256":"218e0d72cd370f31a20e5d08c06f43bdd564134571f8adc5fa082a1ab1590a63","source":"visible/internal/alertquality/smoke_test.go"},{"editable":false,"path":"internal/alertquality/contract_private_test.go","role":"held_out_test","sha256":"3d962ec899f42af3555a5008b613dbdd83be5794ba59d6f2362373f308e46cec","source":"heldout/internal/alertquality/contract_private_test.go"}],"held_out_tests":["internal/alertquality/contract_private_test.go"],"hints":[],"id":"review-gocheck-alert-test-layers-v1","language":"go1.25","limits":{"max_file_bytes":131072,"max_files":18,"max_total_bytes":524288},"race_tests":[],"readonly_paths":["TASK.md","go.mod","internal/alertquality/app.go","internal/alertquality/testdata/alerts.json","internal/alertquality/smoke_test.go"],"version":1,"visible_tests":["internal/alertquality/smoke_test.go"],"workspace_policy":{"allow_delete_files":false,"allow_new_files":true},"workspace_root":"workspace"}