{"actions":{"build":{"max_output_bytes":65536,"network":"none","timeout_ms":8000},"submit":{"max_output_bytes":131072,"network":"none","timeout_ms":15000},"test":{"max_output_bytes":65536,"network":"none","timeout_ms":8000},"vet":{"max_output_bytes":65536,"network":"none","timeout_ms":8000}},"artifact_rules":{"logs":["build","test","vet","submit"],"workspace":"diff"},"assessment_rules":[{"capability_refs":[{"id":"M1-13","version":1}],"condition":"passed","evidence_type":"implement","rule_id":"cancellation-practiced","selector":{"test":"TestMapPreservesOrderAndStopsOnCancellation"},"stage":"visible_test"}],"editable_paths":["map.go"],"files":[{"editable":false,"path":"README.md","role":"readme","sha256":"2fc3f11aa722fbfcd0eb5cd04ead16e14d594debe1474dfe4ec6824ab92386e4","source":"README.md"},{"editable":false,"path":"go.mod","role":"starter","sha256":"aaa8a4440e31282b4246fc9695ead8b0b2c6dd1df9186f07654b638a73cacfb7","source":"starter/go.mod"},{"editable":true,"path":"map.go","role":"starter","sha256":"d702907c56a07383523379d783846f375a701afcb60bbc0aaeaeb079d9e90e03","source":"starter/map.go"},{"editable":false,"path":"map_test.go","role":"visible_test","sha256":"d3efac3d334f4f69db24592878e9933f0ea7c8bea29eca1e60ac51ec1da0793f","source":"visible/map_test.go"}],"held_out_tests":[],"hints":[{"body":"用 context.WithCancel 派生批次 context；父取消会向下传播，任一 transform 失败时也由协调者取消同批工作。","id":"derived-context","level":1,"title":"一个批次，一个派生 context"},{"body":"不要收到首个错误就立即 return；先 cancel，再继续等待结果 channel 关闭，确保 worker 已退出。","id":"drain-before-return","level":2,"title":"记录错误后继续收尾"}],"id":"practice-cancellable-map-v1","language":"go1.25","limits":{"max_file_bytes":65536,"max_files":8,"max_total_bytes":262144},"race_tests":[],"readonly_paths":["README.md","go.mod","map_test.go"],"version":1,"visible_tests":["map_test.go"],"workspace_root":"workspace"}