{"actions":{"build":{"max_output_bytes":131072,"network":"none","timeout_ms":12000},"submit":{"max_output_bytes":262144,"network":"none","timeout_ms":45000},"test":{"max_output_bytes":131072,"network":"none","timeout_ms":15000},"vet":{"max_output_bytes":131072,"network":"none","timeout_ms":12000}},"artifact_rules":{"logs":["build","test","vet","submit"],"workspace":"full"},"assessment_rules":[{"capability_refs":[{"id":"M1-14","version":1}],"condition":"passed","evidence_type":"implement","rule_id":"project-builds","selector":{"package":"./..."},"stage":"build"},{"capability_refs":[{"id":"M1-14","version":1}],"condition":"passed","evidence_type":"implement","rule_id":"project-artifacts-present","selector":{"required_files":["go.mod","README.md","examples/targets.json","cmd/gocheck/main.go"]},"stage":"ast"},{"capability_refs":[{"id":"M1-14","version":1}],"condition":"passed","evidence_type":"implement","rule_id":"configuration-contract-correct","selector":{"test":"TestLoadValidatesConfigurationAndPreservesErrors"},"stage":"held_out_test"},{"capability_refs":[{"id":"M1-14","version":1}],"condition":"passed","evidence_type":"implement","rule_id":"concurrent-workflow-cancellable","selector":{"test":"TestAllBoundsConcurrencyAndReleasesOnCancel"},"stage":"held_out_test"},{"capability_refs":[{"id":"M1-14","version":1}],"condition":"passed","evidence_type":"implement","rule_id":"stable-output-contract","selector":{"test":"TestReportsAreStableInTextAndJSON"},"stage":"held_out_test"},{"capability_refs":[{"id":"M1-14","version":1}],"condition":"passed","evidence_type":"implement","rule_id":"cli-exit-contract-correct","selector":{"test":"TestRunUsesFlagsAndExitCodes"},"stage":"held_out_test"},{"capability_refs":[{"id":"M1-14","version":1}],"condition":"passed","evidence_type":"test","rule_id":"project-tests-present","selector":{"glob":"**/*_test.go","minimum_cases":3},"stage":"ast"},{"capability_refs":[{"id":"M1-14","version":1}],"condition":"passed","evidence_type":"test","rule_id":"race-detector-clean","selector":{"package":"./..."},"stage":"race"},{"capability_refs":[{"id":"M1-14","version":1}],"condition":"passed","evidence_type":"diagnose","rule_id":"delivery-decisions-explained","selector":{"minimum_chars":120,"required_terms":["package","context","httptest","exit code"]},"stage":"explanation"}],"editable_paths":[],"files":[{"editable":false,"path":"TASK.md","role":"readme","sha256":"5d43efd8f9e1ac2593b62ce293929fa8feb66f6b48e2c36d0bd50e91c200fd3e","source":"README.md"},{"editable":false,"path":"testdata/targets.json","role":"fixture","sha256":"888cae7dd8c97009ec7e79f5761e24c87a259071a0886b982af136c7aca7aa63","source":"fixtures/targets.json"},{"editable":false,"path":"internal/config/config_test.go","role":"visible_test","sha256":"dfa06c6cd941901c786d9b0c8064ed4b3c888226bde21cee091c94cdb8cf0509","source":"visible/internal/config/config_test.go"},{"editable":false,"path":"internal/check/check_test.go","role":"visible_test","sha256":"7f93ad4e9413a97e3d774691c452f3daea61dfa8a48f31603b3511a81a54da22","source":"visible/internal/check/check_test.go"},{"editable":false,"path":"internal/report/report_test.go","role":"visible_test","sha256":"f7d55c55009c432484c2017ea1229e648052fd60d55ed8a77629dba172e573cc","source":"visible/internal/report/report_test.go"},{"editable":false,"path":"internal/config/config_private_test.go","role":"held_out_test","sha256":"4cf73a1b0170f71d972abdaac441f392ef0ba03fea788f2327fd538c5b350cf1","source":"heldout/internal/config/config_private_test.go"},{"editable":false,"path":"internal/check/check_private_test.go","role":"held_out_test","sha256":"d88922dc398ff8d16e7217d906e253e4154695c4088f92e10faf51cc446fada2","source":"heldout/internal/check/check_private_test.go"},{"editable":false,"path":"internal/report/report_private_test.go","role":"held_out_test","sha256":"f851af8537fa7317577d7acbd30a0a58543bcfb39c2ae7ee9c7564370a14e8c1","source":"heldout/internal/report/report_private_test.go"},{"editable":false,"path":"internal/app/app_private_test.go","role":"held_out_test","sha256":"38656a75d152228be94289061296c330e1194c2404701afef247ff39b997ab80","source":"heldout/internal/app/app_private_test.go"},{"editable":false,"path":"internal/check/check_race_test.go","role":"race_test","sha256":"2c09326be9832022cd47053481ee192dca6a323f1e8e73fc31e9ce30a6699ee2","source":"race/internal/check/check_race_test.go"}],"held_out_tests":["internal/config/config_private_test.go","internal/check/check_private_test.go","internal/report/report_private_test.go","internal/app/app_private_test.go"],"hints":[{"body":"先创建 go.mod、config/check/report/app 的最小 API，让一个 httptest 目标从配置走到文本输出；编译通过后再增加并发和 JSON。","id":"vertical-slice","level":1,"title":"先交付单目标纵向切片"},{"body":"标出谁创建和关闭 response Body、谁取消派生 context、谁关闭 jobs，以及谁等待 worker；一个资源只能有一个明确的生命周期所有者。","id":"ownership-map","level":2,"title":"为每个资源标出所有者"},{"body":"internal/app.Run 返回 int，方便 httptest 和 buffer 驱动完整流程；只有 cmd/gocheck/main.go 调用 os.Exit。","id":"exit-boundary","level":3,"title":"把 os.Exit 留在 main"}],"id":"assessment-gocheck-project-v1","language":"go1.25","limits":{"max_file_bytes":131072,"max_files":28,"max_total_bytes":1048576},"race_tests":["internal/check/check_race_test.go"],"readonly_paths":["TASK.md","testdata/targets.json","internal/config/config_test.go","internal/check/check_test.go","internal/report/report_test.go"],"version":2,"visible_tests":["internal/config/config_test.go","internal/check/check_test.go","internal/report/report_test.go"],"workspace_policy":{"allow_delete_files":true,"allow_new_files":true},"workspace_root":"workspace"}