{
  "id":"assessment-gocheck-access-control-v1","version":1,"language":"go1.25","workspace_root":"workspace",
  "files":[
    {"source":"README.md","path":"TASK.md","role":"readme","editable":false,"sha256":"ba7f619e880a2646ad3447f321b1a355d7daf68f9999958c5395dde64ab583ae"},
    {"source":"starter/go.mod","path":"go.mod","role":"starter","editable":false,"sha256":"f443b76cffd6971740f2cc15482a8274f6f52f652415262b8c6549d93f6949fd"},
    {"source":"starter/internal/projectapi/handler.go","path":"internal/projectapi/handler.go","role":"starter","editable":true,"sha256":"d487ac809c6ad5a563cd36315c1cfad944ea9cd4e6824d6c715f87f7dd62945c"},
    {"source":"starter/internal/projectapi/handler_test.go","path":"internal/projectapi/handler_test.go","role":"starter","editable":true,"sha256":"de8ef29a6fe537443f04ca5534ffc2f1b18392d8c5604f2aa5c11d6f5c87d1ed"},
    {"source":"visible/internal/projectapi/smoke_test.go","path":"internal/projectapi/smoke_test.go","role":"visible_test","editable":false,"sha256":"6583bb50e104d24a4e56d8d21800e6f7d9f98f9c39c46a31326fc0b28455c297"},
    {"source":"heldout/internal/projectapi/contract_private_test.go","path":"internal/projectapi/contract_private_test.go","role":"held_out_test","editable":false,"sha256":"13b2c39e220907cd1e4d15a3f2adda06520253918b38dc8291c58b0b3e828c33"}
  ],
  "editable_paths":["internal/projectapi/handler.go","internal/projectapi/handler_test.go"],"readonly_paths":["TASK.md","go.mod","internal/projectapi/smoke_test.go"],"workspace_policy":{"allow_new_files":true,"allow_delete_files":false},
  "limits":{"max_files":14,"max_file_bytes":131072,"max_total_bytes":524288},
  "actions":{"build":{"timeout_ms":10000,"max_output_bytes":131072,"network":"none"},"test":{"timeout_ms":12000,"max_output_bytes":131072,"network":"none"},"vet":{"timeout_ms":10000,"max_output_bytes":131072,"network":"none"},"submit":{"timeout_ms":30000,"max_output_bytes":262144,"network":"none"}},
  "hints":[{"id":"authenticate-before-store","level":1,"title":"认证先于资源查询","body":"先完成 Bearer 认证，失败时直接返回 401 并写入 WWW-Authenticate，不要让未认证请求触及 store。"},{"id":"hide-existence","level":2,"title":"跨租户与不存在共用 404","body":"FindProject 成功后比较 OwnerID 与 subject；不匹配时返回与 ErrNotFound 完全相同的包络。"},{"id":"stable-audit-reason","level":3,"title":"日志只收稳定 reason","body":"AuditLogger.Denied 只传 authentication_failed 或 resource_not_found，原始 header、token、project 和底层 error 都不进入参数。"}],
  "visible_tests":["internal/projectapi/smoke_test.go"],"held_out_tests":["internal/projectapi/contract_private_test.go"],"race_tests":[],
  "assessment_rules":[
    {"rule_id":"access-control-builds","stage":"build","selector":{"package":"./..."},"capability_refs":[{"id":"M2-08","version":1}],"evidence_type":"implement","condition":"passed"},
    {"rule_id":"credential-config-safe","stage":"held_out_test","selector":{"test":"TestCredentialConfigurationSafe"},"capability_refs":[{"id":"M2-08","version":1}],"evidence_type":"implement","condition":"passed"},
    {"rule_id":"authentication-secret-safe","stage":"held_out_test","selector":{"test":"TestAuthenticationContractAndSecretSafety"},"capability_refs":[{"id":"M2-08","version":1}],"evidence_type":"implement","condition":"passed"},
    {"rule_id":"resource-authorization-correct","stage":"held_out_test","selector":{"test":"TestResourceAuthorizationPreventsIDOR"},"capability_refs":[{"id":"M2-08","version":1}],"evidence_type":"implement","condition":"passed"},
    {"rule_id":"canonical-input-enforced","stage":"held_out_test","selector":{"test":"TestCanonicalInputAndMethodBoundaries"},"capability_refs":[{"id":"M2-08","version":1}],"evidence_type":"implement","condition":"passed"},
    {"rule_id":"security-failures-stable","stage":"held_out_test","selector":{"test":"TestSecurityFailureResponsesStable"},"capability_refs":[{"id":"M2-08","version":1}],"evidence_type":"implement","condition":"passed"},
    {"rule_id":"constant-time-calls-present","stage":"ast","selector":{"file":"internal/projectapi/handler.go","required_calls":["sha256.Sum256","subtle.ConstantTimeCompare"]},"capability_refs":[{"id":"M2-08","version":1}],"evidence_type":"implement","condition":"passed"},
    {"rule_id":"security-tests-present","stage":"ast","selector":{"file":"internal/projectapi/handler_test.go","minimum_cases":6},"capability_refs":[{"id":"M2-08","version":1}],"evidence_type":"test","condition":"passed"},
    {"rule_id":"security-boundaries-explained","stage":"explanation","selector":{"minimum_chars":180,"required_terms":["authentication","authorization","constant-time","404","secret"]},"capability_refs":[{"id":"M2-08","version":1}],"evidence_type":"diagnose","condition":"passed"}
  ],
  "artifact_rules":{"workspace":"full","logs":["build","test","vet","submit"]}
}
