{"actions":{"build":{"max_output_bytes":131072,"network":"none","timeout_ms":8000},"submit":{"max_output_bytes":262144,"network":"none","timeout_ms":15000},"test":{"max_output_bytes":131072,"network":"none","timeout_ms":8000},"vet":{"max_output_bytes":131072,"network":"none","timeout_ms":8000}},"artifact_rules":{"logs":["build","test","vet","submit"],"workspace":"full"},"assessment_rules":[{"capability_refs":[{"id":"M1-01","version":1}],"condition":"passed","evidence_type":"implement","rule_id":"module-builds","selector":{"package":"./..."},"stage":"build"},{"capability_refs":[{"id":"M1-01","version":1}],"condition":"passed","evidence_type":"diagnose","rule_id":"toolchain-checks-pass","selector":{"package":"./..."},"stage":"vet"},{"capability_refs":[{"id":"M1-03","version":1}],"condition":"passed","evidence_type":"implement","rule_id":"error-chain-preserved","selector":{"test":"TestLoadRejectsInvalidSchemeAndPreservesPathErrors"},"stage":"held_out_test"},{"capability_refs":[{"id":"M1-03","version":1}],"condition":"passed","evidence_type":"implement","rule_id":"resource-closed","selector":{"deferred_call":"Close","file":"internal/config/config.go"},"stage":"ast"},{"capability_refs":[{"id":"M1-07","version":1}],"condition":"passed","evidence_type":"implement","rule_id":"invalid-input-rejected","selector":{"test":"TestLoadRejectsInvalidSchemeAndPreservesPathErrors"},"stage":"held_out_test"},{"capability_refs":[{"id":"M1-07","version":1}],"condition":"passed","evidence_type":"implement","rule_id":"stable-output","selector":{"test":"TestNormalizeSortsTargets"},"stage":"visible_test"},{"capability_refs":[{"id":"M1-07","version":1}],"condition":"passed","evidence_type":"implement","rule_id":"cli-failure-contract","selector":{"package":"cmd/checkcfg"},"stage":"held_out_test"},{"capability_refs":[{"id":"M1-09","version":1}],"condition":"passed","evidence_type":"test","rule_id":"learner-tests-present","selector":{"glob":"**/*_test.go","minimum_cases":3},"stage":"ast"},{"capability_refs":[{"id":"M1-09","version":1}],"condition":"passed","evidence_type":"test","rule_id":"visible-tests-pass","selector":{"package":"./..."},"stage":"visible_test"},{"capability_refs":[{"id":"M1-09","version":1}],"condition":"passed","evidence_type":"test","rule_id":"held-out-tests-pass","selector":{"package":"./..."},"stage":"held_out_test"}],"editable_paths":["cmd/checkcfg/main.go","internal/config/config.go","internal/config/config_test.go"],"files":[{"editable":false,"path":"README.md","role":"readme","sha256":"6cdee8a2b95bf271ac7381f9e040d4a57f700e99ff7f8b0a42b6419a4ae8bf2a","source":"README.md"},{"editable":false,"path":"go.mod","role":"starter","sha256":"456b0a3cb8249977843635cfe811ff0ad8979c9cc0c94da14d97bc3906f26184","source":"starter/go.mod"},{"editable":true,"path":"cmd/checkcfg/main.go","role":"starter","sha256":"2b032a1e71b699e8a1be3141ebed37e5ee7d10f1f3894345f0d7fd3df5247fec","source":"starter/cmd/checkcfg/main.go"},{"editable":true,"path":"internal/config/config.go","role":"starter","sha256":"06bb59c03d414791e89cc30cd2a3e66962f74a03fe6c2798d26ead3262f2417e","source":"starter/internal/config/config.go"},{"editable":true,"path":"internal/config/config_test.go","role":"starter","sha256":"64903b00a1e87f78d3ab2063c0853aad94ad0706f4741ba1c1d386231e82609c","source":"starter/internal/config/config_test.go"},{"editable":false,"path":"internal/config/visible_test.go","role":"visible_test","sha256":"a47e37f674bc096261f2cfbe337dbfd58c321eeee113fa5adac69f900a9bce9f","source":"visible/internal/config/visible_test.go"},{"editable":false,"path":"internal/config/heldout_test.go","role":"held_out_test","sha256":"599728de44f52baf256fdf940b0b59c0986ca795fb943eabe63757b6213c6bd5","source":"heldout/internal/config/heldout_test.go"},{"editable":false,"path":"testdata/valid-targets.json","role":"fixture","sha256":"cfb754d0a158c51f9abc1bf5b840f6f7404f5f1b88d0d33b3e65b66a9adf196e","source":"fixtures/valid-targets.json"}],"held_out_tests":["internal/config/heldout_test.go"],"id":"assessment-check-config-v1","language":"go1.25","limits":{"max_file_bytes":131072,"max_files":16,"max_total_bytes":524288},"readonly_paths":["README.md","go.mod","internal/config/visible_test.go","testdata/valid-targets.json"],"version":1,"visible_tests":["internal/config/visible_test.go"],"workspace_root":"workspace"}