{"actions":{"build":{"max_output_bytes":65536,"network":"none","timeout_ms":8000},"submit":{"max_output_bytes":131072,"network":"none","timeout_ms":20000},"test":{"max_output_bytes":65536,"network":"none","timeout_ms":8000},"vet":{"max_output_bytes":65536,"network":"none","timeout_ms":8000}},"artifact_rules":{"logs":["build","test","vet","submit"],"workspace":"diff"},"assessment_rules":[{"capability_refs":[{"id":"M1-13","version":1}],"condition":"passed","evidence_type":"implement","rule_id":"cancellation-propagates","selector":{"test":"TestFetchAllCancelsSiblings"},"stage":"held_out_test"},{"capability_refs":[{"id":"M1-13","version":1}],"condition":"passed","evidence_type":"implement","rule_id":"workers-release-before-return","selector":{"test":"TestFetchAllHonorsDeadlineAndReleasesWorkers"},"stage":"held_out_test"}],"editable_paths":["fetch.go"],"files":[{"editable":false,"path":"README.md","role":"readme","sha256":"9df83dd468a5389045a3eec698c64c1f95fa9b7dbbd05a58f51c6baa69cc1ac0","source":"README.md"},{"editable":false,"path":"go.mod","role":"starter","sha256":"ef6463e57533e5f29e561630b2f8e8693f1a85977cb573174b65a243f4c83ebe","source":"starter/go.mod"},{"editable":true,"path":"fetch.go","role":"starter","sha256":"3e4a38dee6c9f2cb47d53f534d1a20d17e384595c8f0b385805ed3de3c607e6a","source":"starter/fetch.go"},{"editable":false,"path":"fetch_private_test.go","role":"held_out_test","sha256":"bfee568959101936c82608269b9ccd10234ec4abff5cdc65a585601f695e5175","source":"heldout/fetch_private_test.go"}],"held_out_tests":["fetch_private_test.go"],"hints":[{"body":"仅在派发前检查 ctx 不够；正在执行的 fetch 必须收到派生 context，才能被 deadline 或同批失败唤醒。","id":"pass-context-through","level":1,"title":"把 context 传到真正阻塞处"}],"id":"review-cancellable-fetch-v1","language":"go1.25","limits":{"max_file_bytes":65536,"max_files":8,"max_total_bytes":262144},"race_tests":[],"readonly_paths":["README.md","go.mod"],"version":1,"visible_tests":[],"workspace_root":"workspace"}