{"actions":{"build":{"max_output_bytes":65536,"network":"none","timeout_ms":8000},"submit":{"max_output_bytes":131072,"network":"none","timeout_ms":15000},"test":{"max_output_bytes":65536,"network":"none","timeout_ms":8000},"vet":{"max_output_bytes":65536,"network":"none","timeout_ms":8000}},"artifact_rules":{"logs":["build","test","vet","submit"],"workspace":"full"},"assessment_rules":[{"capability_refs":[{"id":"M1-05","version":1}],"condition":"passed","evidence_type":"implement","rule_id":"domain-invariants-enforced","selector":{"test":"TestTargetEnforcesConstructionInvariants"},"stage":"held_out_test"},{"capability_refs":[{"id":"M1-05","version":1}],"condition":"passed","evidence_type":"implement","rule_id":"behavior-methods-correct","selector":{"test":"TestTargetBehaviorMethodsDriveTransitions"},"stage":"held_out_test"}],"editable_paths":["target.go"],"files":[{"editable":false,"path":"README.md","role":"readme","sha256":"2dcd61c04ceb3ca7d85ba5c6fbc4ee3dd92c9d187a4c8eb1746dedd7bb838565","source":"README.md"},{"editable":false,"path":"go.mod","role":"starter","sha256":"a30ecbf36c667e4adf70f9e3ca67bed83efd7f445f2f4678a9c287c2056fbc82","source":"starter/go.mod"},{"editable":true,"path":"target.go","role":"starter","sha256":"89082c4ecf705225084fd2bdfe0638e1657a46bd68fa87b117be5ea37305d37b","source":"starter/target.go"},{"editable":false,"path":"target_test.go","role":"visible_test","sha256":"800bf2566ed49fc09a5893d8c59db5f08e90f72469a5ce3d38cfb7c3389039d4","source":"visible/target_test.go"},{"editable":false,"path":"target_heldout_test.go","role":"held_out_test","sha256":"7e547a53ed224843020340fd8e189e6faa6cd3b0316178b85cac5544ec9777dd","source":"heldout/target_heldout_test.go"}],"held_out_tests":["target_heldout_test.go"],"hints":[{"body":"先 trim 名称，再检查空值和 failureLimit；只有通过这些条件才返回 Target。","id":"protect-invariants","level":1,"title":"把非法值挡在构造阶段"},{"body":"consecutiveFailures 是事实，State 是派生结果。RecordSuccess 和 RecordFailure 只维护事实，避免两个字段互相矛盾。","id":"derive-state","level":2,"title":"从事实派生状态"}],"id":"assessment-check-model-v1","language":"go1.25","limits":{"max_file_bytes":65536,"max_files":8,"max_total_bytes":262144},"readonly_paths":["README.md","go.mod","target_test.go"],"version":1,"visible_tests":["target_test.go"],"workspace_root":"workspace"}