{"id":"practice-release-gates-v1","version":1,"language":"go1.25","workspace_root":"workspace","files":[{"source":"README.md","path":"TASK.md","role":"readme","editable":false,"sha256":"aacddfffd4846cd50a7a372ebcdc0f510ce7d795088709d01671c24c4c9688b9"},{"source":"starter/go.mod","path":"go.mod","role":"starter","editable":false,"sha256":"eafde665d7c923ba40dd7c57cfb96b756ee0224b21794a1f487fdfa2cdb7fa23"},{"source":"starter/releaseplan/plan.go","path":"releaseplan/plan.go","role":"starter","editable":true,"sha256":"4ee4f98ed2919bf4ac06e2c958638d5cd95d7909f162802dbc9cd54bd633524c"},{"source":"visible/releaseplan/plan_test.go","path":"releaseplan/plan_test.go","role":"visible_test","editable":false,"sha256":"94fd7d8021218ba921eedaf966e08961d62acbe2bc237a2238f28977bbba96ee"},{"source":"heldout/releaseplan/contract_private_test.go","path":"releaseplan/contract_private_test.go","role":"held_out_test","editable":false,"sha256":"f0fe57d4677975747d6bd763d05a5322896b70ee4c51339629fe8e44061c4ee7"}],"editable_paths":["releaseplan/plan.go"],"readonly_paths":["TASK.md","go.mod","releaseplan/plan_test.go"],"limits":{"max_files":10,"max_file_bytes":65536,"max_total_bytes":262144},"actions":{"build":{"timeout_ms":15000,"max_output_bytes":65536,"network":"none"},"test":{"timeout_ms":15000,"max_output_bytes":65536,"network":"none"},"vet":{"timeout_ms":15000,"max_output_bytes":65536,"network":"none"},"submit":{"timeout_ms":45000,"max_output_bytes":131072,"network":"none"}},"hints":[{"id":"required-set","level":1,"title":"先固定完整 gate 集合","body":"用 map 记录允许且必须出现的七个 gate，并在遍历时拒绝未知与重复项。"},{"id":"runtime-boundary","level":2,"title":"运行身份也是发布契约","body":"空用户和 root 都应在执行任何 gate 前被拒绝。"},{"id":"forward-only","level":3,"title":"数据升级只向前","body":"migration mode 必须精确表达 forward-only，不能把 down 当作自动发布步骤。"}],"solution":"建立 required map；拒绝空用户或 root、非 forward-only、未知/重复/缺失 gate。","visible_tests":["releaseplan/plan_test.go"],"held_out_tests":["releaseplan/contract_private_test.go"],"assessment_rules":[{"rule_id":"release-plan-validates","stage":"held_out_test","selector":{"test":"TestReleasePlanRejectsUnsafeOrIncompleteDelivery"},"capability_refs":[{"id":"M2-14","version":1}],"evidence_type":"test","condition":"passed"}],"artifact_rules":{"workspace":"diff","logs":["build","test","vet","submit"]}}
